{
  "schema_version": "2.1",
  "snapshot_id": "SNAP-PILOT-20260827T080000Z",
  "decision_at": "2026-08-27T08:00:00Z",
  "source_mode": "replay",
  "partial": false,
  "events": [
    {
      "event_id": "TEENSY-PILOT-01:BOOT-A:41:PILOT-BIN-01",
      "event_kind": "fill_observation",
      "device_id": "TEENSY-PILOT-01",
      "boot_id": "BOOT-A",
      "sequence": 41,
      "hardware_bin_id": "PILOT-BIN-01",
      "bin_type": "general_waste",
      "observed_at": "2026-08-27T07:58:00Z",
      "received_at": "2026-08-27T07:58:03Z",
      "clock_status": "synchronized",
      "fill_pct": 82.0,
      "weight_kg": null,
      "fill_confidence": 0.91,
      "quality_flags": ["weight_channel_unavailable"],
      "forecast_status": "unavailable",
      "time_to_overflow_hours": null,
      "risk_level": "unknown",
      "forecast_method": "fill-threshold-fallback",
      "model_version": null,
      "calibration_version": "pilot-cal-1"
    },
    {
      "event_id": "TEENSY-PILOT-01:BOOT-A:42:PILOT-BIN-02",
      "event_kind": "fill_observation",
      "device_id": "TEENSY-PILOT-01",
      "boot_id": "BOOT-A",
      "sequence": 42,
      "hardware_bin_id": "PILOT-BIN-02",
      "bin_type": "recycling_return",
      "observed_at": "2026-08-27T07:50:00Z",
      "received_at": "2026-08-27T07:50:04Z",
      "clock_status": "synchronized",
      "fill_pct": 46.0,
      "weight_kg": 249.0,
      "fill_confidence": 0.88,
      "quality_flags": [],
      "forecast_status": "available",
      "time_to_overflow_hours": 36.0,
      "risk_level": "high",
      "forecast_method": "growth-q90-v2",
      "model_version": "forecast-synthetic-2",
      "calibration_version": "pilot-cal-1"
    },
    {
      "event_id": "TEENSY-PILOT-01:BOOT-A:43:PILOT-BIN-03",
      "event_kind": "fill_observation",
      "device_id": "TEENSY-PILOT-01",
      "boot_id": "BOOT-A",
      "sequence": 43,
      "hardware_bin_id": "PILOT-BIN-03",
      "bin_type": "recycling_return",
      "observed_at": "2026-08-27T07:35:00Z",
      "received_at": "2026-08-27T07:35:04Z",
      "clock_status": "synchronized",
      "fill_pct": 30.0,
      "weight_kg": null,
      "fill_confidence": 0.45,
      "quality_flags": ["filter_reacquiring", "weight_channel_unavailable"],
      "forecast_status": "cold_start",
      "time_to_overflow_hours": null,
      "risk_level": "unknown",
      "forecast_method": "fill-threshold-fallback",
      "model_version": null,
      "calibration_version": "pilot-cal-1"
    }
  ]
}
